comment,timestamp
This is America. He will declare Marshall Law instead of Martial Law.,1733246768.0
"Now titled:   


# South Korea's lawmakers vote to lift president's martial law declaration

  
  
FTA: 

""Lawmakers in South Korea unanimously voted to lift a controversial martial law declared Tuesday by President Yoon Suk Yeol, reversing a dramatic decision that shook the nation.

Late Tuesday night, in a surprise TV address, Yoon declared an ""emergency martial law"" and accused the opposition of paralyzing the government with anti-state activities. He said the move was needed to protect the country. Yoon accused the left-leaning opposition of being sympathetic with North Korea and vowed to ""eradicate pro-North Korean forces and protect the constitutional democratic order.""

Opposition leaders immediately denounced the martial law declaration as unconstitutional. Lawmakers quickly arrived at the National Assembly, the country's parliament, to reverse the president's decree as scores of protesters and lawmakers' aides attempted to block soldiers' entry into the main building. The National Assembly's 190 members unanimously voted to lift martial law. South Korea's constitution says the president should comply if a majority of the parliament votes to lift martial law.""",1733245515.0
"It was literally lifted within hours once the Legislature looked at him and called him an absolute nutter.

I'm expecting them to oust him soon - that was SO FAST.

Ground News popped up with the news about martial law and the lifting of it was maybe an hour later.

Bonkers.",1733248410.0
You should look at S Korea’s history. They don’t fuck around with dictatorial leaders any more. Mass civil disobedience follows if fuckery pops up. Learn from it,1733256084.0
Get me off this timeline.,1733257539.0
Good luck with that. We have already lost and the only ones who could do something won’t do anything.,1733253785.0
"Trump 2.0, in cognitive decline at warp speed, on a revenge tour.",1733300783.0
"So yeah, he is pulling a Trump",1733246263.0
No. This is hysteria.,1733269469.0
Exactly my thought.  GOP is delt a massive defeat in the mid terms and this is the stuff Trump will try to pull.  Assuming the GOP haven't discarded him as a lame duck buffoon by then,1733256343.0
"Of course, that was the first thing I thought. Yep he’ll have some excuse. This is gonna be a fun show, that’s all I’ve gotta say.",1733252903.0
Jfc 🤦🏽‍♂️,1733293083.0
I Think this is a bit of an overreaction,1733245706.0
나라 망신 ㅠㅠ,1733249997.0
Yup. Rest assured Trump is watching closely. And learning.,1733262107.0
"Trump was going to become Hitler the last time he was president, he just forgot to.",1733402176.0
"He doesn’t have to declare martial law, half the country is willing to have a civil war for him.",1733403272.0
Yeah ok lol 😆 don’t forget your tinfoil hat,1733282068.0
"South Korea's legislature just successfully overturned their President's Martial Law, so it's moot at this point.",1733247009.0
"Sure. And if an asteroid hits South Korea, Trump will try to do that, too, right? Couldn't be dumber if that is what you were shooting for.",1733266376.0
OP is not grounded in reality and needs to be medicated.,1733257806.0
There’s an epidemic of panic and exaggeration in the millennial generation. My peers are mainly adult children who never grew up. Sad to see.,1733251634.0
I wouldn’t be surprised if Biden did this…just like in his inauguration. White House was fenced and filled with military,1733263613.0
lol trump has no reason to try this at all. He is currently trying to save this scenario from happening from the democrat party,1733270334.0
"People who shop at Marshall’s 100 percent dress better than he does, so I can see why he’s upset.",1733272708.0
Definitely 🤣🤣🤣,1733249606.0
"\>The National Assembly's 190 members unanimously voted to lift martial law.

This wont happen here, Yoon doesnt have the cult obedience that Trump does.  His bootlickers will cheer it and block any attempt to stop it.",1733246031.0
"**Good that the Legislature is standing up.**    

But, like I said, ""Trump will Try""...  hopefully our Legislature will unify and stand up against any act of attempt of Trump to try and declare martial law, and/or suspend the Constitution.",1733245725.0
"""Should""  It remains to be seen how this would be enforced here.",1733245656.0
"Dotard Trump should already be in prison, I'm sure he would already be in prison if he was in korea and did his insurrection bs",1733454601.0
That’s the problem. Congress has proven repeatedly they won’t stand up to Trump.,1733262154.0
But the left told us mashed potato brains Joe was as sharp as ever. Enjoy the next 4 yrs,1733325502.0
He probably won’t wait that long.,1733262320.0
"Planning and overreacting are separate things. When will it be justified to prepare for Trump keeping power? Until he actually does it? That sounds like a pretty late time to start a plan, which is probably the Dem leadership’s entire issue.",1733246180.0
"Or a pre-overreaction.

Also, I don’t know much about the constitutional makeup of South Korea, but I’m gonna guess it’s not as decentralized as our federal system. Even if Trump declared martial law, the majority of “peace keepers” are still under the jurisdiction of local municipalities and the states (national guard, police). It would take a constitutional amendment to #10 for that to change.

Furthermore, counter insurgency doctrine calls for 20-25 soldiers per 1000 residents. Even if every law enforcement officer and soldier played along (~2 million), there wouldn’t be close to enough soldiers to occupy and maintain peace (and that’s not even factoring in how well armed US populace is).

Bottom line, OP needs to touch some grass.",1733246701.0
"Yeah, we’re missing geopolitical context for sure. NK has been Saber rattling now for a few months.

There is more to this.",1733246001.0
"Have you…. seen all of this?? *gestures to everything* 

Already had an insurrection, now a cabinet full of far right power hungry assholes. This is def in the realm of possibilities",1733304615.0
Famous last words of someone who’s not learned anything from the last 10 years,1733313719.0
"We don't know how it plays out, so what are you getting at?",1733246027.0
Nope. Just a learning opportunity for Trump.,1733262192.0
"네, 그것은 비극입니다  

(yes, it is a tragedy)",1733255530.0
"Nope. Our legislature has proven repeatedly its unwillingness to stand up to Trump, even when he encourages lawlessness and violence.",1733262269.0
"Not really given the fact that Republicans have a majority in the House, Senate, and Supreme Court.",1733264334.0
"It's not moot, nor is to be to be taken that lightly.",1733252164.0
I think it’s exactly the opposite sir.,1733262218.0
Not really. Trump is mentally unstable and chaotic as his 2020 mental breakdown showed us lol. Anything is possible with Trump.,1733264801.0
They need to realize they are not kids still creating *confabulated romantic fictions about their childhood*.,1733252084.0
"What event caused the White House to be fenced and additional precautions to be taken?

You're so close. 

January 6th. And who launched that failed insurrection? Trump supporters? Nah, never mind I'm sure that had nothing to do with it.",1733275767.0
"Remind me again how Trump trying to NOT leave office peacefully last time and January 6th somehow evolves into Democrats?

I remember last time Trump won in 2016. Obama was President. Oh yeah and he turned power over peacefully to Trump.

Now contrast that with the last time Trump LOST in 2020. And how did Trump and his supporters react?

Oh that's right Trump spent 3 months claiming the election was stolen, throwing a temper tantrum, inciting his supporters and then they launched January 6th.

We can see which side does this when they lose and don't want to leave power. It's Trump and MAGA. We have the historical record. We have January 6th.

Show me the pictures of supporters of Democratic losing candidates beating cops with flag poles, breaking windows in the Capitol and trying to stop certification because their political candidate lost.

That's right. You don't have them. Because again Trump and MAGA are the ones who try to launch failed coups when they lose",1733276023.0
That's what is scary for us. They fortunately still have guardrails in place. Trump is doing everything he can to remove the guardrails and that is why this is so dangerous.,1733249585.0
What martial law has Trump invoked? He’s not even president right now. You understand how insane you sound to normal people right?,1733262596.0
"Cmon man you know they won’t.

Our Congress is full of cowards and jabronis",1733246119.0
Dude's got the backing of the whole government in January. Most of those low quality mongrels are foaming at the opportunity to sic the military on people. Wouldn't count on the right thing happening. Good shit doesn't happen here.,1733246274.0
"I really REALLY want to hope that they would stand up... But deep down inside, I know they wont.",1733247764.0
"Haha, we’re so cooked.",1733254052.0
"Why does anyone think Trump wants to declare martial law or suspend the constitution? 

I know we don't like him on reddit, but what makes anyone think this is going to happen?",1733246436.0
I'm afraid you may be right :/,1733264398.0
You'd probably  try to tell me that Jan 6  was a nice tourist visit to the U.S. Capitol.,1733246415.0
Well if you want to plan for a potential Trump take over by all means no one's stopping you. That doesn't mean you aren't overreacting.,1733246263.0
Well put.,1733247056.0
"Do you remember Jan 6th, if you do... then you should not be so quick to claim what people like Trump won't **try**.",1733252365.0
That is exactly my point thank you.,1733246319.0
So I take it you still don't know the legislature shot this down about an hour after it was issued.,1733305186.0
"Oh? And then if we learn 4 years later that Trump stepped down after his term, would you admit to overreacting?",1733313814.0
What do you mean what am I getting at? There's nothing to elaborate on your overreacting.,1733246205.0
So when there isn't a martial law military coup will you commit to checking yourself into a mental institution or are you yet another liar on reddit?,1733262789.0
guardrails are irrelevant if you have a big enough cult,1733253101.0
"I'm saying in the same situation there is zero chance our congress would vote 100% against Trump, his braindead dickriders will say how amazing it is that he's fighting the WOKE by having the military seize control of the country.

That said I guarantee he's having people looking into how he can do the same thing right at this moment.",1733264147.0
Do you not understand we are an empire in decline?  Every single government (in human history) has collapsed eventually. What makes you think the MiGhTY UsA is any different?,1733298326.0
Have you been reading his statements since  2020 election? He clearly thinks he should have far more power as President. It’s not insane at all the fear he will try to expand his power as much as possible.,1733335475.0
" He hasn't done it yet, but he could in the future when he is the President.",1733353216.0
They’ll talk a big game but when it comes down to it…they’ll chicken out so quick. A great example is here with our state legislature and Governor Ronald. They all clearly hate him but when shit is going down. They will cower and bow down so quick.,1733249456.0
"BUT, other Congress people are still active politically. Trump is already a lame duck. So it depends on what their constituents think. I’m betting that Bert and Jacob and Muriel aren’t gonna love martial law so much.",1733253016.0
"Because he said it.  Dictator Day-1.  If you don’t believe his words, then say that.  But don’t talk about “anyone” else.",1733246936.0
He has said that he is going to declare an emergency at the borders to begin their deportation fiasco. So somewhere mixed in there I'm sure he's considering martial law. I think it's more complicated for him to suspend the constitution but I don't put it past them...,1733249437.0
He literally attempted an insurrection and electoral coup to stay in power after he decisively lost the election.,1733264733.0
Yoon and Trump are ideologically aligned. Obviously the playbook will be copied. ,1733246832.0
Because Trump basically indirectly said he would.,1733249488.0
"Clearly, you’re either a bot, a Putin clown, or really and truly haven’t been paying attention for the last eight years.",1733253117.0
I’m a bit confused by this comment. Are you under the impression that I don’t think the insurrection was a real thing?,1733246677.0
"I mean, idk what to say, it’s been 10 years of him being pretty clear that he wants to change the constitution to stay in power, plus the insurrection and a thousand other things…anyone suggesting it’s an overreaction is just being naive (I know that’s harsh, but it’s weird how some can just take Trump for his word). I really think this is the Dems entire issue - like, how do they not create a strategy for Russian interference in the election? It’s like they just accepted it happening and never thought, gee, is there some reason their strategy might actually be effective and preventing us from being successful? It’s just being upfront with what’s going on, Dem leadership need to stop being naive.",1733246576.0
"Right, martial law is extreme. But based on the article it seems that shit is really escalating in South Korea to the point where they have detractors destabilizing the culture. 

But we don’t know how, we don’t know the specifics. I’m not jumping to a conclusion on this as others will. 

We also don’t fully even know the why- it’s alluded that North Korea catalyzed this, but how so beyond the usual “we’ve got bombs and know how to use them give us money for the people I can’t feed”

We simply don’t have the specifics to come to a conclusion with assumptions or speculations.",1733246479.0
"Don’t be hyperbolic, you can be wrong and not be insane. But I’m not wrong.",1733262942.0
As we're witnessing. Tragic. At least the people of South Korea aren't going for it. We're screwed.,1733253233.0
"He was joking about the EOs he'd be signing. Perhaps hyperbole is a more accurate term. 

He is known for that. 

But I see where many would prefer to take it literally, and hope that he becomes an actual dictator.",1733247050.0
"The border most definitely is in a state of emergency. I think the tx gov already stated that, but got ignored by the Biden admin. 

We will need a bounty system to deport the millions of  criminals and terrorists who have entered over the last few years. 

I think any illegal migrant who wants to become a law abiding US citizen should be offered an opportunity to do so by assisting in the bounty system. 

I don't see any other way to target and deport millions of criminals.",1733249652.0
Both statements are debatable.,1733264811.0
"Imo that's a bit of a stretch. I'm not a betting man, but if I had to put money on it, I would substantially bet that he will not be copying this move.",1733246957.0
"I’m as anti-Trump as it gets (you can go back however far you want in my post history for proof), but you can’t just declare something “obvious” without proof. This playbook isn’t even laid out in other radical playbooks you *could* refer to, like Project 2025. This is just fear mongering.",1733247651.0
"This was a hyperbolic statement (which he is very well known for) addressing the EOs he'd be signing day one. Namely in regards to the millions of criminals and terrorists we've let in. Which I'm grateful will be addressed before any more American citizens are harmed or killed. 

We should never have allowed it to get to this point.",1733249766.0
Whatever you say friendo,1733253284.0
"I don't know what angle you are coming from.... you started out with using the word ""overreacting"".

When evidentially, you don't grasp how big of a thing Martial Law, and how important it is that the Legislature stepped into denounce it. 

*Presidential words and actions have consequences.*",1733246955.0
Well i'll ignore all that other noise because it's not worth my time but I have a question how do you stop a misinformation campaign? Nobody's been able to figure out how to do that which is why it's effective so do you think you have the answer please let us know.,1733247175.0
Well we do know about the legislative body came in and reversed it lol,1733247013.0
"But in fact you have reality inverted and what is happening in SK is more akin to Democrats going full totalitarian with a ""whole of society"" censorship regime and using Russia as the scapegoat to accuse their political opposition of being agents of.",1733263111.0
You don’t know that.  No one knows that but the man himself.  You are no one.,1733247138.0
"He’s known for spewing shit it off his mouth, then backpedaling when it’s not taken as he wanted.

🤡",1733323199.0
That's insane. These are human beings and they deserve the same opportunities as the rest of us. The hypocrisy of this nation keeping mostly brown people out of the country is heinous and there's nothing that you can say that can make deportation the right move.,1733249972.0
It's only debatable if you're in a cult.,1733265007.0
"Too bad the “millions of criminals and terrorists we’ve let in” aren’t even ones causing this fear mongering uptick in crime that you believe that’s happening.

Legal everyday American citizens are the biggest perpetrators of crime in the US.",1733251228.0
"I think you’re getting me mixed up with the commenter above me, I’m on the same side as you and didn’t start the overreacting stuff but was responding to his comment.

My position: we should prepare now for if Trump decides he wants to stay in power. Waiting till it happens will result in it being too late.",1733247359.0
"BlueSky has demonstrated that putting end users in control of the content and participants that they want to see and interact with is an elective tool to defeat misinformation. 

We need to destroy feed algorithms and put people in control of what they see and who they share with.",1733252544.0
"Frankly, coming from a physics and comp sci background, there are definitely ways to fight this - but I’m not stupid and going to blast that shit on the internet. If someone has made you believe that there’s no solution for fighting this, they don’t know how this shit works.",1733247540.0
"We know that we have a mass of people who are Civics Illiterate about:

1.  **Constitution based Reprehensive Democracy** and 
2. **Constitutional based Republic Form of Representative Government.** 

(many people don't even know what these two things means.)

Therefore, what is needed is ""**Education**, 

***Now, the challenge is, an has been for a long time***, how do you get people in their late 20's, 30's, 40's, 50' and 60's+ to take a class in Civics?     

* *When many won't even take a personal ""skill training class"".    The government has funded organization that teach civics as well as long list of vocational and technical skill training programs.*  

# Idea:

Maybe if we were smart, we'd have everyone ""**re-register to vote**"": 

Since we have to do study a book and take a test to get a license to drive a vehicles,  

We probably should have to at least, take a civics course to get registered to vote.  maybe they don't have to take a test, but they have to take the course)   *That too can be a tiered system, just like some people get a learners permit, well in the case of voting, it can be one that deal with city ordinance, that would be equal to being able to vote in local  city only election,* 

* but one must attend the full civics course to be registered to vote in State and Federal National Election that Elect people to Congress and the Presidency.   

Those course can be done by person teaching and by use of video/audio, for those who can best benefit by those optional methods.  

**It's well worth the expense!!!**",1733251897.0
"Why did you change your talking point after this response?

this is called ""moving the goal-post""",1733299043.0
This may sound dumb as fuck but I’m trying to come to an understanding of this- why did they do that? Ws it because they felt it unnecessary? Thats my best guess,1733249283.0
Looks to me like a president declaring martial law on the basis of those who disagree with him are ruining the country. Right in the orange man’s wheel house I’d say.,1733263451.0
"lol. Wonder what stuff people will come up with in February after this doesn't come to pass. 

Attempting to insult someone doesn't make your viewpoint attractive. 

If anything it only indicates a severe weakness in thought.",1733247329.0
"Please don't take the elementary thought route and attempt to make it a skin color issue. 

 It's about actions and affiliations. If you rape and murder folks, are an active gang member, or on a terrorist watchlist, you've exhausted all your opportunities imo.",1733250094.0
I see you subscribe to menticide.,1733267340.0
"Tell that to the parents of murdered Americans. 

I agree dear mongering is bad, and happens across the aisle. 

But as someone whose lived in an area impacted by the border, I've seen plenty firsthand to know it's an issue. 

But anecdotal stuff aside we can look at data and see it's an issue. 

Anyone who supports people who kill or otherwise harm Americans is mighty SUS imo.",1733251381.0
"**My Apology**, to you!  My comment was actually for the person who said ""*he thinks this is a bit ""over-reacting""*.",1733250459.0
"Yeah but the government doesn't have that level of control over the private sector to prevent State actors from interfering in our elections.  (Yet) 


 He was saying that the government did not create a plan to comebat the interference.  My question is what could they have done? ",1733252756.0
Sir I'm asking you to give me an answer not continuously telling me that there's a way to do it. ,1733247960.0
"So you think the best way to counter-election interference by state actors is by attending a Civics course? 


😂😂😂


I've seen you specifically say a lot of stupid things over the last two weeks but this by far is the stupidest.",1733252038.0
"While I see the merit in this, it could be seen as a violation of the 14th amendment.

We need to make voting mandatory like in Australia.",1733252670.0
I said why in my first sentence. Interesting you would ask anyway.,1733300870.0
"Weird how that didn't happen already. 

Whether martial law is needed or not in the future is entirely up to Democrats and their street level terror troops obeying federal law or not. 

Sadly a number of Democrats have openly declared themselves insurrectionists who will not be obeying federal immigration law and will be dealt with accordingly.",1733263818.0
"Again, you can keep saying whatever - but you are no one.  Sorry if that’s an insult to you - it might come as a shock but Trump nor anyone in congress really gives one rats ass about you.  You are insignificant to their greater goals and purposes.  The sooner you realize this, the sooner you will be Awake.",1733247525.0
It’s not supporting anything but to quickly blame migrants for a majority of crime in the US is pretty SUS when it’s not true. And go ahead and look at the data because Fox News Entertainment isn’t data.,1733252442.0
All good homie 🤙,1733252867.0
"Misinformation is a tough beast. The best plan would have been to strengthen our education system with a very heavy emphasis on civics and critical thinking. Unfortunately, we are on our own at the moment.",1733252916.0
"Fine, give me an hour - I’m going to therapy. When I get out, I’ll message you some potential solutions and if you’re satisfied, you update here with your thoughts. Deal?",1733248036.0
"Call it what you will, you damn sure have no alternative that you have presented\*\*!!!!!\*\*  All you do is push your negatives, but you have no options as to how to improve anything.   You get high on yourself, and have nothing to support or promote doing so, other than pushing your negative denialisms.

*You are more a shit slinger, that has nothing to offer other than slinging shit and pretending you didn't do it, while shit is all over your hands. .*",1733252718.0
"Maybe, re-read the 14th Amendment:

[https://constitution.congress.gov/browse/amendment-14/](https://constitution.congress.gov/browse/amendment-14/)

  
It's not against the 14th Amendment or any other Constitution Amendment, to require people to have a license to drive on **Public** Roadways.   (Get a Driver License, and one can drive on any Public Roadway in the country. )

(Register to Vote and one can vote in America, without being Registered one can't vote)  I did not say anyone had to take a test, I said they have to ""attend class on Civics"" of and for understanding how to live in a : 

1. **Constitution based Reprehensive Democracy** and
2. **Constitutional based Republic Form of Representative Government.**",1733253270.0
Saying you are somehow too good to respond to valid criticism is not how you debate in good faith.,1733302693.0
"Dude, get a grip",1733272315.0
