comment,timestamp
"I agree that almost every single human in a position of extraordinary power, or what some folks would like to call ""elites"" do not care about me, or any other common man, or woman. 

Trump only cares about his image. 

Now he has done things which seemed to be in the best interest of Americans, like getting NATO countries to pay more money since we the American tax payers were paying the most. 

But did he do that because he cares about us, likely not. He only cares about how it makes him look. 

Is it still a good thing? 

Absolutely. 

Now the Biden admin kept about 65% of Trump policies, and simply renamed most of them. 

This is according to Andrew Bustamante a former CIA officer and nuclear missile specialist. Which can also be verified with a little research. Not my opinion. 

My point is that he's actually done well as a POTUS, and is the best choice for a leader we have at this particular time. 

Only time will tell how it all plays out.",1733247978.0
"I did not attempt to blame migrants for the majority of American crime. That would be silly. Now at the rate we are going unchecked, perhaps one day. 

But yeah it's wild to pretend it's not an issue. 

Again anyone who comes in illegally i am open to letting them become citizens. 

So long as they are willing to become law abiding citizens, and not a part of a criminal or terrorist organization. 

I think that's pretty reasonable.",1733252797.0
"Being more educated in civics won't stop misinformation from spreading or taking hold in people's minds.


   Over the last 12 years I've seen very educated people demonstrate this. However critical thinking is an issue here I 100% agree. 


 But again we don't have the capability to boost the critical thinking skills of 150 million voting Americans to the point to defeat a mass misinformation campaign.  ",1733253205.0
Yes I've already expressed multiple times and I would like to see your answers that you figured out that the government hasn't.  ,1733248477.0
It could be argued that it is a test. Where will these classes be offered? Who will administer them? How do we ensure that marginalized communities are able to participate? How do verify? We don’t want to erect voting barriers unnecessarily.,1733253545.0
"No guy what I said was I didn't have time.  


If we're going to talk about good faith at least try not to misrepresent what's being said. That's an oddly peculiar way to put yourself on a pedestal but to each their own. 


Either way retrospectively I ended up being correct.  It was an overreaction.  The legislator ended up reversing course.  Fear mongering over breaking news is never a good idea.",1733305570.0
"What's unhinged? This already happened in 2020, it's just that Orange Hitler was far too nice about it.",1733273825.0
He did not do well as Potus.  Neither did Biden.  That is where you are confused.  And obviously biased.,1733248164.0
"The thing is that you did blame migrants by saying “we’ve allowed millions of criminals and terrorists before any American citizens gets harmed or killed”.

Is illegal immigration a problem? I guess. Do they need to go through the whole process of paperwork and stuff? I wholeheartedly agree.",1733255752.0
"I agree whole heartedly on ""Critical Thinking"" as being needed... and Education is a process that one can build the skill and capability to become a ""critical thinker"".    Critical Thinking is built upon and up from and through foundational information and knowledge about a particular subject matter, and in this case, the subject matter is:

1. Constitution based Representative Democracy and
2. Constitutional based Republic Form of Representative Government.

I know and you know that a lot of people who have their claim of ""education and higher education"" may or may not have had any detail civic classes, and if was an elective, many people would not and did not elect it.

Many people have avoided civics courses, and some political science gets hung up on Party Politics, when nothing in the Constitution declares Parties, Political Parties are basically ""Lobbyist Groups"".

[Article I  Sections 1-9](https://www.archives.gov/founding-docs/constitution-transcript), **does not** one single time mention a Political Party!!!

\_\_\_\_\_\_\_\_\_\_\_\_\_\_\_\_\_\_\_\_\_\_\_\_\_\_\_\_

reference example about *mis-education*

Remember during the crash of 2007-2009, when people who had their financial degree, said they were selling instruments, they did not understand.   Why, becasue many were never taught the basics of ""why the stock market was created and what its principle fiduciary responsibilities were based upon.  The simple premise was:

Institution and Individual could invest in companies, to support ""STABILITY"", ""RESEARCH AND DEVELOPMENT"" AND ""MANAGED GROWTH"".        Instead they were taught to pump, spin and flip and dump and extract a profit in the cycle.",1733253716.0
Correct. The only way out of this at our current moment is to defeat the bad actors with force.,1733253279.0
"Jesus fuck, walking into therapy now. Will follow up in a bit. You must be a fucking blast to debate with.",1733248517.0
"What you actually said was it wasn't WORTH your time.

""at least try not to misrepresent what's being said""

This is funny too:  ""oddly peculiar way to put yourself on a pedestal""...""Either way retrospectively I ended up being correct."". 

Definition of a bad faith arguing hypocrite.",1733319067.0
